{
  "$comment": "Preset «ساده و خوانا» v1 — default for every tenant and the fixed layout for the Free plan. Black-and-white, low-ink. Validates against ../invoice-layout.schema.json. Reference render: ../reference/print-simple.html",
  "schema_version": 1,
  "template_id": "simple_readable",
  "template_version": 1,
  "blocks": [
    {"kind": "shop_name", "area": "header", "align": "right", "visible": true},
    {"kind": "address", "area": "header", "align": "right", "visible": true},
    {"kind": "contact_primary", "area": "header", "align": "right", "visible": true},
    {"kind": "contact_mobile_extra", "area": "header", "align": "right", "visible": true},
    {"kind": "website", "area": "footer", "align": "center", "visible": false},
    {"kind": "license_union", "area": "footer", "align": "center", "visible": false},
    {"kind": "license_online", "area": "footer", "align": "center", "visible": false}
  ],
  "logo": {"visible": false, "size": "small"},
  "items_table": {"columns": ["row_no", "name", "weight_g", "purity", "wage", "profit", "vat", "amount"]},
  "summary": {
    "show_component_breakdown": true,
    "public_note": {"visible": false, "text": ""},
    "signature_box": true
  },
  "typography": {"text_size": "normal", "density": "comfortable", "accent": "ink", "section_spacing": "normal", "dividers": true},
  "print": {"paper": "A4", "orientation": "portrait", "margins": "normal", "repeat_header": true, "repeat_footer": false},
  "version": 0
}
